rank,song,artist,genre,year
23,If I Didn't Have You,Randy Travis,Country,1992
24,Straight Tequila Night,John Anderson,Country,1992
26,Could've Been Me,Billy Ray Cyrus,Country,1992
27,Past The Point Of Rescue,Hal Ketchum,Country,1992
28,Somewhere Other Than the Night,Garth Brooks,Country,1992
29,We Tell Ourselves,Clint Black,Country,1992
30,Seminole Wind,John Anderson,Country,1992
31,Drive South,Suzy Bogguss,Country,1992
32,Watch Me,Lorrie Morgan,Country,1992
33,Born Country,Alabama,Country,1992
34,What Kind of Fool (Do You Think I Am)?,Lee Roy Parnell,Country,1992
35,Better Class Of Losers,Randy Travis,Country,1992
36,Take Your Memory With You,Vince Gill,Country,1992
37,Norma Jean Riley,Diamond Rio,Country,1992
38,Take A Little Trip,Alabama,Country,1992
39,Sacred Ground,McBride & The Ride,Country,1992
40,The Whiskey Ain't Workin',Travis Tritt & Marty Stuart,Country,1992
41,Two Sparrows In A Hurricane,Tanya Tucker,Country,1992
42,Rock My Baby,Shenandoah,Country,1992
43,(Without You) What Do I Do With Me,Tanya Tucker,Country,1992
44,Mercury Blues,Alan Jackson,Country,1992
45,Backroads,Ricky Van Shelton,Country,1992
46,Every Second,Collin Raye,Country,1992
47,Midnight In Montgomery,Alan Jackson,Country,1992
48,All These Years,Sawyer Brown,Country,1992
49,If There Hadn't Been You,Billy Dean,Country,1992
50,Today's Lonely Fool,Tracy Lawrence,Country,1992
51,When It Comes To You,John Anderson,Country,1992
52,You Can Depend On Me,Restless Heart,Country,1992
53,Maybe It Was Memphis,Pam Tillis,Country,1992
54,The Dirt Road,Sawyer Brown,Country,1992
55,Cadillac Style,Sammy Kershaw,Country,1992
56,When She Cries,Restless Heart,Country,1992
57,Some Kind Of Trouble,Tanya Tucker,Country,1992
58,The Tips Of My Fingers,Steve Wariner,Country,1992
59,Papa Loved Mama,Garth Brooks,Country,1992
60,The Greatest Man I Never Knew,Reba McEntire,Country,1992
61,Shake The Sugar Tree,Pam Tillis,Country,1992
62, Come In Out Of The Pain,Doug Stone,Country,1992
63,So Much Like My Dad,George Strait,Country,1992
64,Only The Wind,Billy Dean,Country,1992
65,Warning Labels,Doug Stone,Country,1992
66,Bubba Shot The Jukebox,Mark Chesnutt,Country,1992
67,I Feel Lucky,Mary Chapin Carpenter,Country,1992
68,Burn One Down,Clint Black,Country,1992
69,Nothing Short Of Dying,Travis Tritt,Country,1992
70,Except For Monday,Lorrie Morgan,Country,1992
71,Runnin' Behind,Tracy Lawrence,Country,1992
72,Look At Us,Vince Gill,Country,1992
73,Jesus And Mama,Confederate Railroad,Country,1992
74,The Woman Before Me,Trisha Yearwood,Country,1992
75,Turn That Radio On,Ronnie Milsap,Country,1992
76,Billy The Kid,Billy Dean,Country,1992
77,If Your Heart Ain't Busy Tonight,Tanya Tucker,Country,1992
78,Life's a Dance,John Michael Montgomery,Country,1992
79,Is It Cold In Here,Joe Diffie,Country,1992
80,Old Flames Have New Names,Mark Chesnutt,Country,1992
81,Ships That Don't Come In,Joe Diffie,Country,1992
82,Lord Have Mercy On The Working Man,Travis Tritt,Country,1992
83,Wrong Side Of Memphis,Trisha Yearwood,Country,1992
84,Wild Man,Ricky Van Shelton,Country,1992
85,Going Out Of My Mind,McBride & The Ride,Country,1992
86,You And Forever And Me,Little Texas,Country,1992
87,What Kind Of Love,Rodney Crowell,Country,1992
88,Even the Man in the Moon Is Cryin',Mark Collie,Country,1992
89,Gone As A Girl Can Get,George Strait,Country,1992
90,I Wouldn't Have It Any Other Way,Aaron Tippin,Country,1992
91,Cafe On The Corner,Sawyer Brown,Country,1992
92,Lost And Found,Brooks & Dunn,Country,1992
93,Letting Go,Suzy Bogguss,Country,1992
94,Leave Him Out Of This,Steve Wariner,Country,1992
95,Let Go of the Stone,John Anderson,Country,1992
96,Whatcha Gonna Do with a Cowboy (with Chris LeDoux),Garth Brooks,Country,1992
97,Nowhere Bound,Diamond Rio,Country,1992
98,"This One's Gonna Hurt You (For a Long, Long Time)",Marty Stuart,Country,1992
99,Whatcha Gonna Do With A Cowboy,Chris LeDoux,Country,1992
100,It Only Hurts When I Cry,Dwight Yoakam,Country,1992
1,Chattahoochee,Alan Jackson,Country,1993
2,I Love The Way You Love Me,John Michael Montgomery,Country,1993
3,"Easy Come, Easy Go",George Strait,Country,1993
4,Alibis,Tracy Lawrence,Country,1993
5,Fast as You,Dwight Yoakam,Country,1993
6,Thank God For You,Sawyer Brown,Country,1993
7,Blame It On Your Heart,Patty Loveless,Country,1993
8,John Deere Green,Joe Diffie,Country,1993
9,Should've Been A Cowboy,Toby Keith,Country,1993
10,What Part Of No,Lorrie Morgan,Country,1993
11,Somewhere Other Than The Night,Garth Brooks,Country,1993
12,What's It To You,Clay Walker,Country,1993
13,Rock My World (Little Country Girl),Brooks & Dunn,Country,1993
14,"Look Heart, No Hands",Randy Travis,Country,1993
15,Ain't Going Down ('Til the Sun Comes Up),Garth Brooks,Country,1993
16,The Heart Won't Lie,Reba McEntire & Vince Gill,Country,1993
18,Reckless,Alabama,Country,1993
19,It Sure Is Monday,Mark Chesnutt,Country,1993
20,I Don't Call Him Daddy,Doug Supernaw,Country,1993
21,Can I Trust You With My Heart,Travis Tritt,Country,1993
22,One More Last Chance,Vince Gill,Country,1993
23,State of Mind,Clint Black,Country,1993
24,She Don't Know She's Beautiful,Sammy Kershaw,Country,1993
25,When My Ship Comes In,Clint Black,Country,1993
26,Can't Break It To My Heart,Tracy Lawrence,Country,1993
27,A Bad Goodbye,Clint Black,Country,1993
28,What Might Have Been,Little Texas,Country,1993
29,Why Didn't I Think Of That,Doug Stone,Country,1993
30,Too Busy Being In Love,Doug Stone,Country,1993
31,The Song Remembers When,Trisha Yearwood,Country,1993
32,Wild One,Faith Hill,Country,1993
33,Almost Goodbye,Mark Chesnutt,Country,1993
34,Ain't That Lonely Yet,Dwight Yoakam,Country,1993
35,That Summer,Garth Brooks,Country,1993
36,Does He Love You,Reba McEntire,Country,1993
37,Heartland,George Strait,Country,1993
38,It's A Little Too Late,Tanya Tucker,Country,1993
39, She Used To Be Mine,Brooks & Dunn,Country,1993
40,My Second Home,Tracy Lawrence,Country,1993
41,Tell Me Why,Wynonna Judd,Country,1993
42,In The Heart Of A Woman,Billy Ray Cyrus,Country,1993
43,Holdin' Heaven,Tracy Byrd,Country,1993
44,American Honky-Tonk Bar Association,Garth Brooks,Country,1993
45,Passionate Kisses,Mary Chapin Carpenter,Country,1993
46,We'll Burn That Bridge,Brooks & Dunn,Country,1993
49,In A Week Or Two,Diamond Rio,Country,1993
50,God Blessed Texas,Little Texas,Country,1993
51,Walkaway Joe,Trisha Yearwood,Country,1993
53,Tender Moment,Lee Roy Parnell,Country,1993
54,Queen Of Memphis,Confederate Railroad,Country,1993
55,Hearts Are Gonna Roll,Hal Ketchum,Country,1993
56,Soon,Tanya Tucker,Country,1993
57,A Thousand Miles From Nowhere,Dwight Yoakam,Country,1993
58,My Baby Loves Me,Martina McBride,Country,1993
59,Learning To Live Again,Garth Brooks,Country,1993
60,Only Love,Wynonna Judd,Country,1993
61,She's Not Cryin' Anymore,Billy Ray Cyrus,Country,1993
62,Every Little Thing,Carlene Carter,Country,1993
63,Prop Me Up Beside The Jukebox (If I Die),Joe Diffie,Country,1993
64,Once Upon A Lifetime,Alabama,Country,1993
65,No Time To Kill,Clint Black,Country,1993
66,Sure Love,Hal Ketchum,Country,1993
68,Hometown Honeymoon,Alabama,Country,1993
69,My Strongest Weakness,Wynonna Judd,Country,1993
70,No Future In The Past,Vince Gill,Country,1993
71,"Love On The Loose, Heart On The Run",McBride & The Ride,Country,1993
72,Life's A Dance,John Michael Montgomery,Country,1993
73,That Was A River,Collin Raye,Country,1993
74,Hard Workin' Man,Brooks & Dunn,Country,1993
75,It's Your Call,Reba McEntire,Country,1993
76,Tonight I Climbed The Wall,Alan Jackson,Country,1993
77,He Ain't Worth Missing,Toby Keith,Country,1993
78,Reno,Doug Supernaw,Country,1993
79,I Want to Be Loved Like That,Shenandoah,Country,1993
80,She'd Give Anything,Boy Howdy,Country,1993
81,Tell Me About It,Tanya Tucker,Country,1993
82,Old Country,Mark Chesnutt,Country,1993
84,Let That Pony Run,Pam Tillis,Country,1993
85,Just Like The Weather,Suzy Bogguss ,Country,1993
86,(Who Says) You Can't Have It All,Alan Jackson,Country,1993
87,Alright Already,Larry Stewart,Country,1993
88,Take It Back,Reba McEntire,Country,1993
89,Trouble On The Line,Sawyer Brown,Country,1993
90,Honky Tonk Attitude,Joe Diffie,Country,1993
91,Just One Night,McBride & The Ride,Country,1993
92,Somebody Else's Moon,Collin Raye,Country,1993
93,"Oh Me, Oh My, Sweet Baby",Diamond Rio,Country,1993
94,Tryin' To Hide A Fire In The Dark,Billy Dean,Country,1993
95,Lord Have Mercy on the Working Man,Travis Tritt,Country,1993
96,Romeo,Dolly Parton,Country,1993
97,Made For Lovin' You,Doug Stone,Country,1993
98,When Did You Stop Loving Me,George Strait,Country,1993
99,Hey Cinderella,Suzy Bogguss,Country,1993
100,My Blue Angel,Aaron Tippin,Country,1993
3, Pickup Man,Joe Diffie,Country,1994
4,The Red Strokes,Garth Brooks,Country,1994
5,Don't Take The Girl,Tim McGraw,Country,1994
6,Be My Baby Tonight,John Michael Montgomery,Country,1994
8,Wink,Neal McCoy,Country,1994
9,Third Rock From The Sun,Joe Diffie,Country,1994
10,Livin' On Love,Alan Jackson,Country,1994
11,Summertime Blues,Alan Jackson,Country,1994
12,Till You Love Me,Reba McEntire,Country,1994
13,Shut Up And Kiss Me ,Mary Chapin Carpenter,Country,1994
14,No Doubt About It,Neal McCoy,Country,1994
15,XXX's And OOO's (An American Girl),Trisha Yearwood,Country,1994
16,Live Until I Die,Clay Walker,Country,1994
17,She's Not The Cheatin' Kind,Brooks & Dunn,Country,1994
18,Tryin' To Get Over You,Vince Gill,Country,1994
19,Piece Of My Heart,Faith Hill,Country,1994
20,Foolish Pride,Travis Tritt,Country,1994
21,If The Good Die Young,Tracy Lawrence,Country,1994
22,If I Could Make A Living,Clay Walker,Country,1994
23,A Good Run Of Bad Luck,Clint Black,Country,1994
24,Whenever You Come Around,Vince Gill,Country,1994
25,Who's That Man,Toby Keith,Country,1994
26,I Never Knew Love,Doug Stone,Country,1994
27,Dreaming With My Eyes Open,Clay Walker,Country,1994
28,I Just Wanted You To Know,Mark Chesnutt,Country,1994
29,If You've Got Love,John Michael Montgomery,Country,1994
30,Your Love Amazes Me,John Berry,Country,1994
31,Whisper My Name,Randy Travis,Country,1994
32,The Big One,George Strait,Country,1994
33,If Bubba Can Dance (I Can Too),Shenandoah,Country,1994
34,That Ain't No Way To Go,Brooks & Dunn,Country,1994
35,Thinkin' Problem,David Ball,Country,1994
37,Not a Moment Too Soon,Tim McGraw,Country,1994
38,My Kind of Girl,Collin Raye,Country,1994
39,He Thinks He'll Keep Her,Mary Chapin Carpenter,Country,1994
40,Standing Outside The Fire,Garth Brooks,Country,1994
41,State Of Mind,Clint Black,Country,1994
42,I See It Now,Tracy Lawrence,Country,1994
44,Gone Country,Alan Jackson,Country,1994
45,What The Cowgirls Do,Vince Gill,Country,1994
46,Down On The Farm,Tim McGraw,Country,1994
47,Take Me As I Am,Faith Hill,Country,1994
48,Every Once In A While,BlackHawk,Country,1994
49,Wish I Didn't Know Now,Toby Keith,Country,1994
50,Fast As You,Dwight Yoakam,Country,1994
51,Love A Little Stronger,Diamond Rio,Country,1994
52,When You Walk In The Room,Pam Tillis,Country,1994
53,Before You Kill Us All,Randy Travis,Country,1994
54,Callin' Baton Rouge,Garth Brooks,Country,1994
56,National Working Woman's Holiday,Sammy Kershaw,Country,1994
57,Rock Bottom,Wynonna Judd,Country,1994
58,A Little Less Talk And A Lot More Action,Toby Keith,Country,1994
59,Watermelon Crawl,Tracy Byrd,Country,1994
60,I Try To Think About Elvis,Patty Loveless,Country,1994
61,I Take My Chances,Mary Chapin Carpenter,Country,1994
62,I'd Like To Have That One Back,George Strait,Country,1994
63,They Don't Make 'Em Like That Anymore,Boy Howdy,Country,1994
64,When Love Finds You,Vince Gill,Country,1994
65,Indian Outlaw,Tim McGraw,Country,1994
66,I Want To Be Loved Like That,Shenandoah,Country,1994
67,Walking Away A Winner,Kathy Mattea,Country,1994
68,I've Got It Made,John Anderson,Country,1994
69,I'm Holding My Own,Lee Roy Parnell,Country,1994
70,How Can I Help You Say Goodbye,Patty Loveless,Country,1994
72,Rope The Moon,John Michael Montgomery,Country,1994
73,The Man In Love With You,George Strait,Country,1994
74,I Can't Reach Her Anymore,Sammy Kershaw,Country,1994
75,She Can't Say I Didn't Cry ,Rick Trevino,Country,1994
76,Lifestyles Of The Not So Rich And Famous,Tracy Byrd,Country,1994
77,Bend It Until It Breaks,John Anderson,Country,1994
78,Addicted To A Dollar,Doug Stone,Country,1994
79,Hangin' In,Tanya Tucker,Country,1994
80,Untanglin' My Mind,Clint Black,Country,1994
81,The Boys And Me,Sawyer Brown,Country,1994
82,I Wish I Could Have Been There,John Anderson,Country,1994
83,Kick A Little,Little Texas,Country,1994
84,Why Haven't I Heard From You,Reba McEntire,Country,1994
85,Half The Man,Clint Black,Country,1994
87,What's In It For Me,John Berry,Country,1994
88,You and Only You,John Berry,Country,1994
92,Spilled Perfume,Pam Tillis,Country,1994
93,This Is Me,Randy Travis,Country,1994
94,The City Put The Country Back In Me,Neal McCoy,Country,1994
95,Hard To Say,Sawyer Brown,Country,1994
96,Now I Know,Lari White,Country,1994
97,When The Thought Of You Catches Up With Me,David Ball,Country,1994
98,Is It Over Yet,Wynonna,Country,1994
99,We Can't Love Like This Anymore,Alabama,Country,1994
100,The First Step,Tracy Byrd,Country,1994
1,"I Like It, I Love It",Tim McGraw,Country,1995
2,It Matters to Me,Faith Hill,Country,1995
3,Not A Moment Too Soon,Tim McGraw,Country,1995
4,That's As Close As I'll Get To Loving You,Aaron Tippin,Country,1995
5,Summer's Comin',Clint Black,Country,1995
6,Thinkin' About You,Trisha Yearwood ,Country,1995
7,She's Every Woman,Garth Brooks,Country,1995
8,Sold (The Grundy County Auction Incident),John Michael Montgomery,Country,1995
9,This Woman And This Man,Clay Walker,Country,1995
10,Any Man Of Mine,Shania Twain,Country,1995
11,What Mattered Most,Ty Herndon,Country,1995
12,"Tall, Tall Trees",Alan Jackson,Country,1995
13,I Can Love You Like That,John Michael Montgomery,Country,1995
14,Check Yes Or No,George Strait,Country,1995
15,If I Could Make a Living,Clay Walker,Country,1995
17,Not On Your Love,Jeff Carson,Country,1995
18,My Kind Of Girl,Collin Raye,Country,1995
19,Mi Vida Loca (My Crazy Life),Pam Tillis,Country,1995
20,Old Enough To Know Better,Wade Hayes,Country,1995
21,Dust On The Bottle,David Lee Murphy,Country,1995
22,You Can't Make A Heart Love Somebody,George Strait,Country,1995
23,You Can Feel Bad,Patty Loveless,Country,1995
24,The Keeper Of The Stars,Tracy Byrd,Country,1995
25,Someone Else's Star,Bryan White,Country,1995
26,"One Boy, One Girl",Collin Raye,Country,1995
27,Texas Tornado,Tracy Lawrence,Country,1995
28,You're Gonna Miss Me When I'm Gone,Brooks & Dunn,Country,1995
29,The Heart Is A Lonely Hunter,Reba McEntire,Country,1995
30,So Help Me Girl,Joe Diffie,Country,1995
31,Who Needs You Baby,Clay Walker,Country,1995
32,Gonna Get A Life,Mark Chesnutt,Country,1995
33,Little Miss Honky Tonk,Brooks & Dunn,Country,1995
34,I Don't Even Know Your Name,Alan Jackson,Country,1995
35,I Didn't Know My Own Strength,Lorrie Morgan,Country,1995
36,I'm Not Strong Enough To Say No,BlackHawk,Country,1995
37,Can't Really Be Gone,Tim McGraw,Country,1995
38,Bigger Than the Beatles,Joe Diffie,Country,1995
39,You Ain't Much Fun,Toby Keith,Country,1995
40,When You Say Nothing at All,Alison Krauss,Country,1995
42, Goin' Through The Big D,Mark Chesnutt,Country,1995
44,As Any Fool Can See,Tracy Lawrence,Country,1995
45,You Better Think Twice,Vince Gill,Country,1995
46,Standing On The Edge Of Goodbye,John Berry,Country,1995
47,If The World Had A Front Porch,Tracy Lawrence,Country,1995
48,You Have The Right To Remain Silent,Perfect Stranger,Country,1995
49,Tell Me I Was Dreaming,Travis Tritt,Country,1995
50,One Emotion,Clint Black,Country,1995
51,For A Change,Neal McCoy,Country,1995
52,No Man's Land,John Michael Montgomery,Country,1995
53,I Let Her Lie,Daryle Singletary,Country,1995
54,A Little Bit Of You,Lee Roy Parnell,Country,1995
55, The Car,Jeff Carson,Country,1995
56,And Still,Reba McEntire,Country,1995
58,She Ain't Your Ordinary Girl,Alabama,Country,1995
59,They're Playin' Our Song,Neal McCoy,Country,1995
60,Give Me One More Shot,Alabama,Country,1995
61,In Between Dances,Pam Tillis,Country,1995
62,Wherever You Go,Clint Black,Country,1995
63,I'm Not Supposed to Love You Anymore,Bryan White,Country,1995
64,Should've Asked Her Faster,Ty England,Country,1995
65,In Pictures,Alabama,Country,1995
66,Better Things To Do,Terri Clark,Country,1995
67,Like There Ain't No Yesterday,Blackhawk,Country,1995
68,That Ain't My Truck,Rhett Akins ,Country,1995
69,Adalida,George Strait,Country,1995
70,You And Only You,John Berry,Country,1995
71,I'm Still Dancin' With You,Wade Hayes,Country,1995
72,Whose Bed Have Your Boots Been Under?,Shania Twain,Country,1995
73,Not Enough Hours in the Night,Doug Supernaw,Country,1995
74,Life Gets Away,Clint Black,Country,1995
75,Refried Dreams,Tim McGraw,Country,1995
76,Back In Your Arms Again,Lorrie Morgan,Country,1995
77,Safe In The Arms Of Love,Martina McBride,Country,1995
78, If I Were You,Collin Raye,Country,1995
79,Which Bridge To Cross (Which Bridge To Burn),Vince Gill,Country,1995
81,Darned If I Don't (Danged If I Do),Shenandoah,Country,1995
82,I Think About It All The Time,John Berry,Country,1995
83,You Don't Even Know Who I Am,Patty Loveless,Country,1995
84,Let's Go To Vegas,Faith Hill,Country,1995
85,Amy's Back In Austin,Little Texas,Country,1995
86,I Don't Believe In Goodbye,Sawyer Brown,Country,1995
88,Doctor Time,Rick Trevino,Country,1995
89,Life Goes On,Little Texas,Country,1995
90,Whiskey Under The Bridge,Brooks & Dunn,Country,1995
91,I'll Never Forgive My Heart ,Brooks & Dunn,Country,1995
92,Song For The Life,Alan Jackson,Country,1995
93,This Is Me Missing You,James House,Country,1995
94,Fall In Love,Kenny Chesney,Country,1995
95,Party Crowd,David Lee Murphy,Country,1995
96,Halfway Down,Patty Loveless,Country,1995
97,Bobbie Ann Mason,Rick Trevino,Country,1995
98,Tender When I Want To Be,Mary Chapin Carpenter,Country,1995
99,That's Just About Right,BlackHawk,Country,1995
100,Love Lessons,Tracy Byrd,Country,1995
1,My Maria,Brooks & Dunn,Country,1996
2,Little Bitty,Alan Jackson,Country,1996
3,It Matters To Me,Faith Hill,Country,1996
5,(If You're Not In It For Love) I'm Outta Here!,Shania Twain,Country,1996
6,Can't Be Really Gone,Tim McGraw,Country,1996
7,Like The Rain,Clint Black,Country,1996
8,One Way Ticket (Because I Can),LeAnn Rimes,Country,1996
9,Strawberry Wine,Deana Carter,Country,1996
10,Time Marches On,Tracy Lawrence,Country,1996
11,Bigger Than The Beatles,Joe Diffie,Country,1996
12,You Win My Love,Shania Twain,Country,1996
13,A Man This Lonely,Brooks & Dunn,Country,1996
15,Guys Do It All The Time,Mindy McCready,Country,1996
16,So Much For Pretending,Bryan White,Country,1996
17,She Never Lets It Go To Her Heart,Tim McGraw,Country,1996
18,No News,Lonestar,Country,1996
19,To Be Loved By You,Wynonna,Country,1996
20,Carried Away,George Strait,Country,1996
21,Blue Clear Sky,George Strait,Country,1996
22,Rebecca Lynn,Bryan White,Country,1996
23,She's Taken a Shine,John Berry,Country,1996
24,Daddy's Money,Ricochet,Country,1996
25,Living In A Moment,Ty Herndon,Country,1996
26,Wild Angels,Martina McBride,Country,1996
27,No One Needs To Know,Shania Twain,Country,1996
28,Believe Me Baby (I Lied),Trisha Yearwood,Country,1996
29,Does That Blue Moon Ever Shine On You,Toby Keith,Country,1996
31,Lonely Too Long,Patty Loveless,Country,1996
32,I'll Try,Alan Jackson,Country,1996
34,Hypnotize The Moon,Clay Walker,Country,1996
35,Don't Get Me Started,Rhett Akins,Country,1996
36,Me And You,Kenny Chesney,Country,1996
37,Every Light In The House,Trace Adkins,Country,1996
38,The Beaches Of Cheyenne,Garth Brooks,Country,1996
39,"Heads Carolina, Tails California",Jo Dee Messina,Country,1996
40,The Fear Of Being Alone,Reba McEntire,Country,1996
41,On A Good Night,Wade Hayes,Country,1996
43,Learning As You Go,Rick Trevino,Country,1996
44,I Don't Think I Will,James Bonamy,Country,1996
45,I Am That Man,Brooks & Dunn,Country,1996
46, Stars Over Texas,Tracy Lawrence,Country,1996
47,Every Time I Get Around You,David Lee Murphy,Country,1996
48,Not That Different,Collin Raye,Country,1996
49,When Boy Meets Girl,Terri Clark,Country,1996
50,More Than You'll Ever Know,Travis Tritt,Country,1996
51,Amen Kind of Love,Daryle Singletary,Country,1996
52,Not Enough Hours In The Night,Doug Supernaw,Country,1996
53,I Think About You,Collin Raye,Country,1996
54,Treat Her Right,Sawyer Brown,Country,1996
55,Heart's Desire,Lee Roy Parnell,Country,1996
56,Big Love,Tracy Byrd,Country,1996
58,You Gotta Love That,Neal McCoy,Country,1996
59,Blue,LeAnn Rimes,Country,1996
61,Someone Else's Dream,Faith Hill,Country,1996
62,Then You Can Tell Me Goodbye,Neal McCoy,Country,1996
63,I'm Not Supposed To Love You Anymore,Bryan White,Country,1996
65,What I Meant To Say,Wade Hayes,Country,1996
66,That Ol' Wind,Garth Brooks,Country,1996
67,That's What I Get For Lovin' You,Diamond Rio,Country,1996
68,Too Much Fun,Daryle Singletary,Country,1996
69, Cowboy Love,John Michael Montgomery,Country,1996
70,"Poor, Poor Pitiful Me",Terri Clark,Country,1996
71,I Can Still Make Cheyenne,George Strait,Country,1996
72,The Maker Said Take Her,Alabama,Country,1996
73,If You Loved Me,Tracy Lawrence,Country,1996
74,That Girl's Been Spyin' On Me,Billy Dean,Country,1996
75,Long As I Live,John Michael Montgomery,Country,1996
76,She Drew a Broken Heart,Patty Loveless,Country,1996
77,Goodnight Sweetheart,David Kersh,Country,1996
78,Maybe We Should Just Sleep On It Tonight,Tim McGraw,Country,1996
79,The Road You Leave Behind,David Lee Murphy,Country,1996
80,I Know She Still Loves Me,George Strait,Country,1996
81,"Only On Days That End In ""Y""",Clay Walker,Country,1996
82,Worlds Apart,Vince Gill,Country,1996
83,My Heart Has A History,Paul Brandt,Country,1996
84,All I Want Is A Life,Tim McGraw,Country,1996
85,It's What I Do,Billy Dean,Country,1996
86,It's Midnight Cinderella,Garth Brooks,Country,1996
87,Meant To Be,Sammy Kershaw,Country,1996
88,Ten Thousand Angels,Mindy McCready,Country,1996
89,What Do I Know,Ricochet,Country,1996
90,Change My Mind,John Berry,Country,1996
91,Deep Down,Pam Tillis,Country,1996
92,You Can't Lose Me,Faith Hill,Country,1996
93,Holdin' On To Somethin',Jeff Carson,Country,1996
94,Jacob's Ladder,Mark Wills,Country,1996
95,Half Way Up,Clint Black,Country,1996
96,If I Were You,Terri Clark,Country,1996
97,A Woman's Touch,Toby Keith,Country,1996
98,Her Man,Gary Allan,Country,1996
99,It Wouldn't Hurt To Have Wings,Mark Chesnutt,Country,1996
100,You're Not In Kansas Anymore,Jo Dee Messina,Country,1996
1,It's Your Love,Tim McGraw with Faith Hill,Country,1997
2,Love Gets Me Every Time,Shania Twain,Country,1997
4,One Night At A Time,George Strait,Country,1997
5,Don't Be Stupid (You Know I Love You),Shania Twain,Country,1997
6,We Danced Anyway, Deana Carter,Country,1997
7,A Broken Wing,Martina McBride,Country,1997
8,She's Got It All,Kenny Chesney,Country,1997
9,Longneck Bottle,Garth Brooks,Country,1997
10,Love of My Life,Sammy Kershaw,Country,1997
11,What If,Reba McEntire,Country,1997
14,Something That We Do,Clint Black,Country,1997
15,How Do I Get There,Deana Carter,Country,1997
16,Carrying Your Love With Me,George Strait,Country,1997
17,How Your Love Makes Me Feel,Diamond Rio,Country,1997
18,(This Ain't) No Thinkin' Thing,Trace Adkins,Country,1997
19,There Goes,Alan Jackson,Country,1997
21,Everywhere,Tim McGraw,Country,1997
23,Sittin' On Go,Bryan White,Country,1997
24,Come Cryin' To Me,Lonestar,Country,1997
25,From Here To Eternity,Michael Peterson,Country,1997
26,Is That A Tear ,Tracy Lawrence,Country,1997
27,Running Out Of Reasons To Run,Rick Trevino,Country,1997
28,Me Too,Toby Keith,Country,1997
29,We Were In Love,Toby Keith,Country,1997
30,Better Man Better Off,Tracy Lawrence,Country,1997
32,She's Taken A Shine,John Berry,Country,1997
33,I Left Something Turned On At Home,Trace Adkins,Country,1997
34,Just to See You Smile,Tim McGraw,Country,1997
35,"Drink, Swear, Steal & Lie",Michael Peterson,Country,1997
37,How Was I To Know,John Michael Montgomery,Country,1997
38,On The Verge,Collin Raye,Country,1997
39,Sad Lookin' Moon,Alabama,Country,1997
41,Go Away,Lorrie Morgan,Country,1997
42,Loved Too Much,Ty Herndon,Country,1997
43,The Rest Of Mine,Trace Adkins,Country,1997
44,In Another's Eyes,Trisha Yearwood,Country,1997
45,Amen Kind Of Love,Daryle Singletary,Country,1997
46,I'd Rather Ride Around With You,Reba McEntire,Country,1997
47,Pretty Little Adriana,Vince Gill,Country,1997
49,He's Got You,Brooks & Dunn,Country,1997
50,The Fool,Lee Ann Womack,Country,1997
51,What The Heart Wants,Collin Raye,Country,1997
53,Thank God For Believers,Mark Chesnutt,Country,1997
54,Please,The Kinleys,Country,1997
55,Honky Tonk Truth,Brooks & Dunn,Country,1997
56,"Dancin', Shaggin' On The Boulevard",Alabama,Country,1997
57,She Drew A Broken Heart,Patty Loveless,Country,1997
58,Love Is The Right Place,Bryan White,Country,1997
59,She's Sure Taking It Well,Kevin Sharp,Country,1997
60,How Do I Live,LeAnn Rimes,Country,1997
61,Today My World Slipped Away,George Strait,Country,1997
63,Everybody Knows,Trisha Yearwood,Country,1997
64,A Girl's Gotta Do (What a Girl's Gotta Do),Mindy McCready,Country,1997
65,Between the Devil and Me,Alan Jackson,Country,1997
66,Maybe We Should Just Sleep On It,Tim McGraw,Country,1997
67,Another You,David Kersh,Country,1997
68,(Don't Take Her) She's All I Got,Tracy Byrd,Country,1997
69,How A Cowgirl Says Goodbye,Tracy Lawrence,Country,1997
70,Holdin',Diamond Rio,Country,1997
71,If You Love Somebody,Kevin Sharp,Country,1997
72,All The Good Ones Are Gone,Pam Tillis,Country,1997
73,I Miss You A Little,John Michael Montgomery,Country,1997
74,Little Red Rodeo,Collin Raye,Country,1997
75,Watch This,Clay Walker,Country,1997
76,Good As I Was To You,Lorrie Morgan,Country,1997
77,This Night Won't Last Forever,Sawyer Brown,Country,1997
78,Count Me In,Deana Carter,Country,1997
79,You Walked In,Lonestar,Country,1997
81,The Light In Your Eyes,LeAnn Rimes,Country,1997
83,Land Of The Living,Pam Tillis,Country,1997
84,The Shake,Neal McCoy,Country,1997
85,Places I've Never Been,Mark Wills,Country,1997
